"","Chevron","United States","http://www.chevron.com","North America","Mature","70","0","25","91","273","119","AMS:CHTEX","0393ec59-73c7-c747-c97d-43455ff3adfb","https://www.crunchbase.com/organization/chevron?utm_source=crunchbase&utm_medium=export&utm_campaign=odm_csv","","grid.473921.a, grid.450623.6, grid.482401.b, grid.498097.b, grid.450626.3, grid.471079.c","4295903744","","",""
"","Nissan Motor Corporation","Japan","https://www.nissan-global.com/EN/","Asia","Mature","64","0","85","96","273","64","TYO:7201, NSANY:OTC PINK","718eb41b-a309-8cd4-5e01-9958ac876ee5","https://www.crunchbase.com/organization/nissan-motor","Nissan; Nissan Motor; Nissan Motor Co., Ltd","grid.466950.8, grid.436438.e, grid.436440.1, grid.450033.1","4295877341","","",""
"","Merck","United States","http://www.merck.com","North America","Mature","63","0","6","98","273","241","NYSE:MRK","2f9b212a-d3aa-a8c2-6317-516127c8ba88","https://www.crunchbase.com/organization/merck-co-inc?utm_source=crunchbase&utm_medium=export&utm_campaign=odm_csv","","grid.292545.d, grid.419143.a, grid.39009.33, grid.464961.8, grid.418210.e, grid.491328.5, grid.497565.c, grid.476490.8, grid.473108.9","4295904886","","",""
"","DCS Corp","United States","http://www.dcscorp.com/","North America","Unknown","63","0","0","98","273","565","","c6a5533f-f0fc-eeda-2c18-2dc4a6ef83ba","https://www.crunchbase.com/organization/dcs-corp","Dcs; Dcs Corporation","grid.421015.3","4296387486","","",""
"","Biogen","United States","https://www.biogen.com/en_us/home.html","North America","Mature","55","0","1","107","273","440","NASDAQ:BIIB","aaa4a215-5105-818e-55f9-b956a80f4dac","https://www.crunchbase.com/organization/biogen-idec?utm_source=crunchbase&utm_medium=export&utm_campaign=odm_csv","","grid.476059.9, grid.476052.2, grid.497435.8, grid.476066.5, grid.476080.d, grid.482381.4, grid.476070.2, grid.417832.b","4295906748","","",""
"","Aptiv","Ireland","http://www.aptiv.com/","Europe","Mature","53","0","98","108","273","58","NYSE:APTV","4a7ae512-46ea-42c2-8cbb-b6b25b2b11c5","https://www.crunchbase.com/organization/aptiv?utm_source=crunchbase&utm_medium=export&utm_campaign=odm_csv","Aptiv Plc; Delphi Automotive","grid.424068.c, grid.424072.7, grid.424078.d, grid.424080.a, grid.433612.1, grid.471192.8, grid.507542.1","5035155584, 5057754612, 5050269299","","Delphi, nuTonomy",""
"","Motorola Solutions Inc.","United States","https://www.motorolasolutions.com/","North America","Mature","49","0","51","111","273","86","FRA:MTLA, NYSE:MSI","d65bcbfb-b94e-e848-a953-bcd89ab7de00","https://www.crunchbase.com/organization/motorola-solutions?utm_source=crunchbase&utm_medium=export&utm_campaign=odm_csv","Motorola; Motorola Inc; Motorola Mobility Holdings, Inc; Motorola Solutions; Motorola Solutions Inc; Motorola Solutions, Inc; Motorola Solutions, Inc. (Nyse: Msi)","grid.467466.1, grid.472797.8, grid.436550.1","4295904562","","",""
"","AP Moller - Maersk A/S","Denmark","https://www.maersk.com/","Europe","Mature","47","0","0","112","273","565","OTC:AMKBF","58b21ff3-f198-ac9f-82bf-6d40f03d973c","https://www.crunchbase.com/organization/maersk","A.P. Moller - Maersk A/S; A.P. Moller U2013 Maersk; Maersk","grid.436909.1","5076360326","","",""
"","Total Sa","France","https://www.total.com/","Europe","Mature","44","0","9","116","273","200","NYSE:TOT, FRA:TOTB, LSE:TTA","844d9eb3-43d1-642e-cb37-292b61c12475","https://www.crunchbase.com/organization/total","Total; Total S.A","grid.424348.d, grid.464178.8, grid.426275.0, grid.451448.8, grid.486627.9, grid.461632.4, grid.434603.6, grid.498664.1, grid.434601.4, grid.480390.6","","","",""
"","Dow Inc.","United States","https://www.dow.com/","North America","Mature","43","0","5","117","273","264","NYSE:DOW, LSE:0A1S, FRA:2OY","59b7688c-0df2-df63-2ad1-b67bfb092879","https://www.crunchbase.com/organization/the-dow-chemical-company?utm_source=crunchbase&utm_medium=export&utm_campaign=odm_csv","Dow; Dow Chemical Co; The Dow Company","grid.418574.b, grid.433686.c, grid.410451.5, grid.473041.5, grid.482393.7, grid.473042.6, grid.433683.9, grid.433687.d, grid.474467.2","4295903880","Dowdupont (Acquired)","",""
"","Thermo Fisher Scientific","United States","https://www.thermofisher.com/","North America","Mature","42","0","10","121","273","188","NYSE:TMO","b0422dd2-b32a-efc0-a274-c65351f5c8a9","https://www.crunchbase.com/organization/thermo-fisher-scientific","Thermo Fisher Scientific Inc","grid.418190.5, grid.472783.d, grid.410750.7, grid.447844.f, grid.436774.5, grid.460561.0, grid.424957.9, grid.473206.4, grid.459494.1, grid.420349.8, grid.433187.a, grid.458319.2, grid.420150.2, grid.425568.8, grid.421691.9","4295905068","","",""
"","QinetiQ Group PLC","United Kingdom","https://www.qinetiq.com/","Europe","Mature","37","0","2","129","273","375","LSE:QQ","cbc44e3a-e2f0-e9f2-4102-9971256a14ed","https://www.crunchbase.com/organization/qinetiq","Qinetiq","grid.7545.3, grid.423148.8","4295897710","","",""
"","Soar Technology, Inc.","United States","https://soartech.com/","North America","Unknown","36","0","0","131","273","565","","8c8354fa-7398-9fb2-5907-14d89f4ad4d5","https://www.crunchbase.com/organization/soar-technologies","Soar Technologies; Soartech","grid.454518.9","","","",""
"","Medtronic","United States","http://www.medtronic.com/","North America","Mature","31","0","107","138","273","54","NYSE:MDT","d5b9d6ac-97a8-1abf-c138-5c548d4acb38","https://www.crunchbase.com/organization/medtronic?utm_source=crunchbase&utm_medium=export&utm_campaign=odm_csv","","grid.497670.b, grid.481699.b, grid.497563.a, grid.487289.8, grid.497411.e, grid.464081.f, grid.432921.f, grid.451033.0, grid.419671.c, grid.425561.1, grid.472782.c, grid.473020.2, grid.474334.3, grid.453490.f, grid.471158.e, grid.419673.e","5043331632","","",""
"","Infervision","China","https://global.infervision.com/","Asia","Mature","30","0","16","139","273","155","","20197234-4c5f-467e-3fcd-ae2a9f524a4b","https://www.crunchbase.com/organization/infervision","Beijing Infervision Technology Co Ltd; Infervision Beijing Co Ltd; Tuixiang Keji; 北京推想科技有限公司; 推想科技","grid.507939.1","5053126581","","",""
"","Janssen Research & Development","United States","https://www.janssen.com/","North America","Unknown","30","0","0","139","273","565","","","","Janssen Research & Development Llc; R&D At Janssen","","4297914575","Johnson & Johnson","",""
"","Genomic Health","United States","http://www.genomichealth.com","North America","Mature","29","0","1","141","273","440","NASDAQ:GHDX","0ce2aed7-d113-6596-3b54-67a9a98790e3","https://www.crunchbase.com/organization/genomic-health","Genomic Health, Inc","grid.467415.5","4295910638","Exact Sciences (Acquired)","",""
"","Western Digital","United States","https://www.westerndigital.com/","North America","Mature","28","0","36","142","273","98","FRA:WDC","efbc7a23-0558-c9d5-d9f2-609c433a2c4b","https://www.crunchbase.com/organization/western-digital","Wd; Wdc; Western Digital Corp; Western Digital Corporation; Western Digital Technologies, Inc","grid.451113.3, grid.474491.b, grid.474490.a, grid.480194.0, grid.471242.6","4295905332","","",""
"","Caterpillar Inc","United States","http://www.caterpillar.com/","North America","Mature","27","0","44","143","273","92","EOA:CATR, FRA:CAT1, LSE:0Q18","201e94e7-a1a0-9330-76a4-467f3c0fd29c","https://www.crunchbase.com/organization/caterpillar-inc","Caterpillar, Inc; Catterpillar","grid.418702.8, grid.472809.0, grid.472811.9, grid.481602.9, grid.472808.1","4295903678","","",""
"","Rockwell Automation Inc.","Denmark","https://www.rockwellautomation.com/","Europe","Mature","27","0","9","143","273","200","NYSE:ROK","ed73eabc-f399-4c58-aef0-60cc0c02ad33","https://www.crunchbase.com/organization/rockwell-automation","Ra; Rockwell Automation; Rockwell Automation Inc; Rockwell Automation, Inc","grid.455982.7, grid.451300.3, grid.474459.f, grid.474458.e, grid.481737.e, grid.437397.d","4295904837","","",""
"","Ceres Environmental Services Inc","United States","http://ceresenvironmental.com/","North America","Unknown","27","0","1","143","273","440","","01db9110-1e59-42fd-9ebb-f7a5a21451bd","https://www.crunchbase.com/organization/ceres-environmental-services-inc","Ceres; Ceres Environmental; Ceres Environmental Services; Ceres Environmental Services, Inc","","","","",""
"","DMS Pharmaceutical Group Inc","United States","http://www.dmspharma.com/","North America","Unknown","27","0","0","143","273","565","","287d9254-59b6-4a2e-a835-94e6d7254106","https://www.crunchbase.com/organization/dms-pharmaceutical-group?utm_source=crunchbase&utm_medium=export&utm_campaign=odm_csv","Dms; Dms Pharmaceutical; Dms Pharmaceutical Group; Dms Pharmaceutical Group, Inc","","5035945175","","",""
"","Perkinelmer","United States","http://www.perkinelmer.com/","North America","Mature","26","0","2","149","273","375","NYSE:PKI, FRA:PKN, LSE:0KHE","9dbcdc8e-6a6e-dd40-51c3-26d7ec27f354","https://www.crunchbase.com/organization/perkinelmer","Perkin-Elmer; Perkinelmer, Inc","grid.419236.b, grid.423505.5, grid.432358.b, grid.439038.5, grid.474409.a, grid.482382.7, grid.482371.b","4295912239","","",""
"","Procter & Gamble","United States","https://us.pg.com/","North America","Mature","24","0","25","155","273","119","ONOF:LSE, NYSE:PG","5d910027-649d-c49c-2aa0-863ddc47183f","https://www.crunchbase.com/organization/procter-and-gamble?utm_source=crunchbase&utm_medium=export&utm_campaign=odm_csv","P&G; Procter & Gamble Co; Procter & Gamble Company","grid.418758.7, grid.425582.c, grid.425587.9, grid.437153.7, grid.437154.0, grid.471168.d, grid.481634.c, grid.482092.5, grid.486099.a, grid.491507.e, grid.497580.7","4295903247","","",""
"","Yaskawa","Japan","https://www.yaskawa.co.jp/","Asia","Mature","24","0","15","155","273","158","OTCPINK:YASKF","a0fba635-e4fa-7b36-f0a4-412aab258417","https://www.crunchbase.com/organization/yaskawa-electric-corporation","安川電機","grid.471331.3","4296861097, 4295880715","","Yaskawa America, Inc.",""
"","DJI","China","https://www.dji.com/","Asia","Mature","23","0","49","158","273","87","","43149a55-3eb5-b954-c600-f1f00a07070b","https://www.crunchbase.com/organization/dji","Da-Jiang Innovations; Dajiang Chuangxin Keji Youxian Gongsi; Dji Innovations; Dji International Co Ltd; Dã -JiäNg Innovations Science And Technology; Sz Dji Technology Co., Ltd; 大疆; 大疆创新; 大疆创新科技有限公司","grid.493767.8","5060004785","","",""
"","Marathon Petroleum Corp","United States","https://www.marathonpetroleum.com/","North America","Mature","23","0","1","158","273","440","NYSE:MPC, NYQ:MPC, LSE:0JYA, STU:MPN, BER:MPN, FRA:MPN, DEU:MPN, MUN:MPN, MEX:MPC*, ASE:MPC, DUS:MPN, BRN:MPN, SAO:M1PC34","3e98fae6-be2f-d4f4-9c49-b72c1731b965","https://www.crunchbase.com/organization/marathon-petroleum","Marathon Petroleum; Marathon Petroleum Corporation; Mpc","","5001438555","","",""
"","Eko","United States","https://ekohealth.com","North America","Growth","23","0","0","158","273","565","","60b0e87f-4c3b-8822-787c-6968da2a99e0","https://www.crunchbase.com/organization/eko-health","Eko Devices; Eko Devices, Inc; Eko Health","","5039269819","","",""
"","Alion Science and Technology Corp","United States","https://www.alionscience.com/","North America","Mature","23","0","0","158","273","565","","25a5ef0c-f057-785d-0b90-29b253ed8152","https://www.crunchbase.com/organization/alion-science-and-technology","Alion; Alion Science And Technology; Alion Science And Technology Corporation","grid.285204.9","4296905424","","",""
"","Eaton Corp PLC","Ireland","http://www.eaton.com","Europe","Mature","22","0","10","163","273","188","NYSE:ETN, LSE:0Y3K","87080248-e519-1749-3b6b-4899f197f358","https://www.crunchbase.com/organization/eaton","Eaton; Eaton Corp; Eaton Corporation; Eaton Corporation Inc; Eaton Corporation Plc","grid.434314.5, grid.472851.d, grid.473049.d, grid.473050.5, grid.473053.6, grid.474426.7, grid.497073.e, grid.501308.f","5037629126","","",""
"","Alphabet","United States","https://abc.xyz/","North America","Mature","22","0","0","163","273","565","NASDAQ:GOOGL","096694c6-bcd2-a975-b95c-fab77c81d915","https://www.crunchbase.com/organization/alphabet?utm_source=crunchbase&utm_medium=export&utm_campaign=odm_csv","Alphabet Inc","grid.497059.6","5050702354, 5053732847, 5030853586","","Verily Life Sciences, Waymo","Google, DeepMind, Fitbit, Google Brain, Google Robotics"
"","Fanuc Corporation","Japan","http://www.fanuc.co.jp/eindex.htm","Asia","Mature","21","0","275","170","273","34","OTCPINK:FANUF","8bf1109c-84c6-2f89-eaed-697666f8129d","https://www.crunchbase.com/organization/fanuc-robotics-america?utm_source=crunchbase&utm_medium=export&utm_campaign=odm_csv","","grid.471089.3, grid.498312.5","","","",""
"","Agilent Technologies","United States","http://www.agilent.com","North America","Mature","21","0","4","170","273","291","NYSE:A","743ccb60-78a8-45cd-35bb-f6f1797f38f5","https://www.crunchbase.com/organization/agilent?utm_source=crunchbase&utm_medium=export&utm_campaign=odm_csv","Agilent; Agilent Technologies Inc; Agilent Technologies, Inc","grid.422181.c, grid.422638.9, grid.423789.3, grid.424055.2, grid.432798.3, grid.432800.d, grid.464737.5, grid.467186.a, grid.472743.1, grid.472745.7, grid.496842.5, grid.498523.1, grid.501287.9, grid.502454.2","4295908720","","",""
"","The Emmes Corporation","United States","https://secure.emmes.com/emmesweb","North America","Unknown","21","0","1","170","273","440","","dce2763a-61e4-44fc-8adc-8a41858931fb","https://www.crunchbase.com/organization/emmes","Emmes; Emmes Corp; The Emmes Company, Llc","grid.280434.9","5035542542","","",""
"","ANSYS","United States","https://www.ansys.com/","North America","Mature","20","0","6","177","273","241","NASDAQ:ANSS, LSE:0HG3, FRA:AKX","1b8932fa-d91d-b048-806b-df0dc123a07a","https://www.crunchbase.com/organization/ansys","Ansys, Inc","grid.455453.6, grid.432624.5, grid.424675.6, grid.506627.0, grid.421480.b","4295905566","","",""
"","IHS Markit Ltd.","United Kingdom","https://ihsmarkit.com/","Europe","Mature","20","0","0","177","273","565","NYSE:INFO, LSE:0UAI, FRA:0M3","46d41aaa-2ed5-a2b4-c0d2-cfda5ffbde96","https://www.crunchbase.com/organization/ihs-markit","Ihs Markit; Markit Ltd","grid.424511.7, grid.473149.c, grid.433895.0, grid.439100.f, grid.450735.0","5042370971","IHS (Acquired)","",""
"","Fortinet","United States","https://www.fortinet.com/","North America","Mature","18","0","9","183","273","200","FRA:FO8, LSE:0IR9, NASDAQ:FTNT","d77eeaa5-c240-8cf3-e41e-a696d9729abd","https://www.crunchbase.com/organization/fortinet","Fortinet, Inc","","4295935222","","",""
"","Gilead Sciences","United States","https://www.gilead.com/","North America","Mature","18","0","0","183","273","565","NASDAQ:GILD","46e8888f-9880-12cf-8d47-a8f6b0d80204","https://www.crunchbase.com/organization/gilead-sciences?utm_source=crunchbase&utm_medium=export&utm_campaign=odm_csv","Gilead; Gilead Sciences Inc; Gilead Sciences, Inc","grid.418227.a, grid.481870.2, grid.437263.7, grid.492741.d, grid.488274.5, grid.488276.7, grid.488275.4, grid.476328.c","4295906595","","",""
"","Force 3 Inc","United States","http://www.force3.com/","North America","Unknown","18","0","0","183","273","565","","bf3c01db-ef4c-9eb0-cb7c-6ab4ef50556c","https://www.crunchbase.com/organization/force","Force 3","","4295987590","Sirius Computer Solutions (Acquired)","",""
"","Applied Materials","United States","http://www.appliedmaterials.com","North America","Mature","17","0","35","190","273","100","NASDAQ:AMAT, FWB:AP2","c3dbc7b1-fc7e-8fa8-581c-5090a328b447","https://www.crunchbase.com/organization/applied-materials","Applied Materials Inc; Applied Materials, Inc","grid.432741.7, grid.432770.5, grid.455223.7, grid.472798.7, grid.432772.7","4295905583","","",""
"","UniSound","China","http://www.unisound.com/","Asia","Mature","17","0","19","190","273","141","","1c24e068-59ab-0479-57f8-6cf92a14df12","https://www.crunchbase.com/organization/unisound-beijing","Beijing Unisound Information Technology Co Ltd; UniSound; Yunzhisheng; 云知声; 北京云知声信息技术有限公司","","5044176578","","",""
"","Maxar Technologies","Canada","http://www.maxar.com/","North America","Mature","17","0","0","190","273","565","TSX:MAXR","d61dfbad-3e26-d21e-f413-1801f94fdf37","https://www.crunchbase.com/organization/macdonald-dettwiler-and-associates","Macdonald, Dettwiler And Associates","grid.474532.3","5064759123, 5067485478","","Radiant Solutions",""
"","Colgate-Palmolive","United States","https://www.colgate.com/","North America","Mature","17","0","0","190","273","565","NYSE:CL, LSE:0P59","0ec80d2c-a5bd-d11d-eba5-a30dc4c609be","https://www.crunchbase.com/organization/colgate-palmolive","Colgate; Colgate Palmolive; Colgate-Palmolive Co; Colgate-Palmolive Company; Colgate-Palmolive Company (Colgate)","grid.418753.c, grid.467381.f, grid.497528.5","4295903113","","",""
"","Quest Diagnostics","United States","https://www.questdiagnostics.com/","North America","Mature","16","0","19","199","273","141","NYSE:DGX","1f10a1d5-8ab1-9c76-7dc4-3f29fc0601d3","https://www.crunchbase.com/organization/quest-diagnostics?utm_source=crunchbase&utm_medium=export&utm_campaign=odm_csv","Quest; Quest Diagnostics Inc; Quest Diagnostics Incorporated","grid.418124.a","4295904788","","",""
"","Quanta Services Inc.","United States","http://www.quantaservices.com/","North America","Mature","16","0","5","199","273","264","NYSE:PWR","6715f0b7-f8ed-5240-4050-c393670b2785","https://www.crunchbase.com/organization/quanta-services-inc","Quanta; Quanta Services; Quanta Services, Inc","","4295904787","","",""
"","Veracyte, Inc.","United States","https://www.veracyte.com/","North America","Mature","16","0","3","199","273","328","NASDAQ:VCYT","0c247e85-1cd2-9457-5974-563d02e99bf9","https://www.crunchbase.com/organization/veracyte?utm_source=crunchbase&utm_medium=export&utm_campaign=odm_csv","Calderome, Inc; Veracyte; Veracyte Inc","grid.503590.a","4297788018","","",""
"","Cardinal Health Inc","United States","https://www.cardinalhealth.com/en.html","North America","Mature","16","0","0","199","273","565","NYSE:CAH, NYQ:CAH, LSE:0HTG, BUE:CAH3, BER:CLH, FRA:CLH, MUN:CLH, DEU:CAH, DUS:CLH, STU:CLH, ASE:CAH, MEX:CAH*, BRN:CLH, SAO:C1AH34","34fb1fce-6082-b01c-f8fa-c3a7574aab7d","https://www.crunchbase.com/organization/cardinal-health","Cardinal Health; Cardinal Health, Inc","grid.438824.1, grid.481810.4, grid.482389.c","4295903651","","",""
"","LinkDoc","China","linkdoc.com","Asia","Mature","15","0","0","206","273","565","","2a13fde3-91ba-7cb2-18f4-fed41f993736","https://www.crunchbase.com/organization/linkdoc-technology","Linkdoc Technology Beijing Co Ltd; Linkdoc Technology Limited","","5050714199","","",""
"","Foxconn","Taiwan","http://www.foxconn.com","Asia","Mature","14","0","62","210","273","74","TPE:2354","cee4abef-8d9f-02e1-682e-d226fcf00106","https://www.crunchbase.com/organization/foxconn-technology-group?utm_source=crunchbase&utm_medium=export&utm_campaign=odm_csv","Foxconn Technology Group; Hon Hai Precision Industry Co; Hon Hai Precision Industry Co., Ltd","grid.471047.1, grid.471120.1, grid.474770.7, grid.481631.9, grid.481660.d","4296384112, 5000069307","","Belkin",""
"","Boston Scientific","United States","https://www.bostonscientific.com/","North America","Mature","14","0","53","210","273","83","NYSE:BSX, LSE:0HOY","59005f4e-129b-e7dd-75ce-8d13c77cde21","https://www.crunchbase.com/organization/boston-scientific","Boston Scientific Corp; Boston Scientific Corporation","grid.418905.1, grid.480044.c, grid.491240.a, grid.491697.4, grid.491698.b","4295903586","","",""
"","3M","United States","https://www.3m.com","North America","Mature","14","0","29","210","273","112","NYSE:MMM","0e8aeaff-bbd3-cebc-7b8d-dedb6c239b11","https://www.crunchbase.com/organization/3m?utm_source=crunchbase&utm_medium=export&utm_campaign=odm_csv","3M Co; Minnesota Mining And Manufacturing Company","grid.292815.5, grid.417536.2, grid.423994.1, grid.431822.e, grid.434574.5, grid.472815.d","5000072036","","Advance Technology Group, 3M",""
"","Stryker Corp.","United States","https://www.stryker.com/","North America","Mature","14","0","9","210","273","200","NYSE:SYK","0ddcc0a7-8f74-6985-0638-dacdbb5ef503","https://www.crunchbase.com/organization/stryker","Stryker; Stryker Iberia, Sl","grid.433922.d, grid.473999.9, grid.481769.5, grid.472763.3, grid.474669.e, grid.474665.2, grid.492949.b, grid.487436.a, grid.487440.b, grid.473121.2","4295904996","","",""
"","BP","United Kingdom","https://www.bp.com/","Europe","Mature","14","0","4","210","273","291","LSE:BP, FWB:BPE, NYSE:BP","e1df0636-887f-828b-f94e-79ffd8b890f1","https://www.crunchbase.com/organization/bp-3","Bp P.L.C; Bp Plc; British Petroleum","grid.1236.6, grid.426623.7, grid.431411.2, grid.435539.d, grid.450508.c, grid.456984.2, grid.457656.3","4295894740","","",""
"","Morgan Stanley","United States","http://www.morganstanley.com","North America","Mature","14","0","2","210","273","375","NYQ:MS, LSE:0QYU, NYSE:MS","0d33753d-a1d4-1b5e-7dae-b4c4a046513c","https://www.crunchbase.com/organization/morgan-stanley?utm_source=crunchbase&utm_medium=export&utm_campaign=odm_csv","Morgan Stanley & Co; 摩根士丹利","grid.423629.8, grid.458387.5, grid.416108.a","4295904557, 8589934299","","E*Trade",""
"","The Boston Consulting Group (BCG)","United States","https://www.bcg.com/","North America","Unknown","14","0","2","210","273","375","","22eef412-8f8c-2d0b-a80f-1e7936f0399c","https://www.crunchbase.com/organization/boston-consulting-group?utm_source=crunchbase&utm_medium=export&utm_campaign=odm_csv","Bcg; Boston Consulting Group; Boston Consulting Group Inc; The Boston Consulting Group","","4296562358","","",""
"","Sherpa","Spain","http://sherpa.ai/","Europe","Growth","14","0","1","210","273","440","","afe10962-3677-6c29-0531-4fd660ca2514","https://www.crunchbase.com/organization/sherpa-assistant","Sherpa Europe S.L; Sherpa Europe Sl; Sherpa.Ai","","5067938072","","",""
"","General Atomics Technologies Corp","United States","http://www.ga.com/","North America","Mature","14","0","1","210","273","440","","1b13346b-33b9-6722-753c-846d2ff54d86","https://www.crunchbase.com/organization/general-atomics","Ga; General Atomics; General Atomics (Ga); General Atomics Corp","grid.192673.8","4298537876","","",""
"","Kongsberg Gruppen ASA","Norway","http://www.kongsberg.com/","Europe","Mature","14","0","1","210","273","440","FRA:KOZ, LSE:0F08","60e17ea3-12ad-b887-d989-8099236dd629","https://www.crunchbase.com/organization/kongsberg-gruppen","Kongsberg; Kongsberg Gruppen","grid.435825.d, grid.425627.0","4295885408","","",""
"","Leading Technology Composites Inc","United States","http://ltc-ltc.com/","North America","Unknown","14","0","0","210","273","565","","a82375a8-b1b2-4329-9365-809113a203c1","https://www.crunchbase.com/organization/leading-technology-composites-inc","Leading Technology Composites, Inc; Ltc; Ltc, Inc","","5002653155","","",""
"","IDEXX Laboratories","United States","https://www.idexx.com/","North America","Mature","13","0","2","226","273","375","NASDAQ:IDXX, LSE:0J8P","57b6bd82-07d1-50be-da2a-45fabbe98fb8","https://www.crunchbase.com/organization/idexx-laboratories","IDEXX Laboratories Inc; IDEXX Laboratories, Inc; Idexx; Idexx Laboratories, Inc. (Idxx)","grid.493313.f, grid.497035.c","4295906763","","",""
"","Xanadu","Canada","http://www.xanadu.ai","North America","Growth","13","0","1","226","273","440","","b9c6dcbb-ba28-6dc6-ffee-2943c7c997c8","https://www.crunchbase.com/organization/xanadu-2","Xanadu Quantum Technologies Inc","","5056440900","","",""
"","Regency Centers Corporation","United States","https://www.regencycenters.com/","North America","Mature","13","0","0","226","273","565","NASDAQ:REG","ee03fbd3-95e6-55da-5fad-c68ad44e1265","https://www.crunchbase.com/organization/regency-centers","Regency; Regency Centers; Regency Centers Corp; Regency Square Properties","","4295904812","","",""
"","KBR Inc","United States","http://www.kbr.com/","North America","Mature","13","0","0","226","273","565","NYSE:KBR, FRA:K6B, FRA:C3J, LSE:0JPN, NYQ:KBR, ASE:KBR","3ce147d9-8008-6572-361a-e2f3c6962710","https://www.crunchbase.com/organization/kbr-inc","KBR; Kbr, Inc","","4295906353","","",""
"","Advanced Alliant Solutions Team LLC","United States","http://www.advancedalliant.com/","North America","Unknown","13","0","0","226","273","565","","","","Aast; Advanced Alliant Solutions Team; Advanced Alliant Solutions Team (Aast)","","","","",""
"","Lincoln National","United States","https://www.lfg.com/","North America","Unknown","12","0","9","234","273","200","","baf86045-7415-30e1-ed64-a910e543f35a","https://www.crunchbase.com/organization/lincoln-financial-group","Lincoln Financial; Lincoln Financial Group; Lincoln National Corp; Lincoln National Corporation; Lnc","","4295904418","","",""
"","IDx Technologies","United States","https://www.eyediagnosis.net/","North America","Growth","12","0","3","234","273","328","","4cd2b309-c59a-ea08-f256-66e947328fd6","https://www.crunchbase.com/organization/idx-2","Digital Diagnostics Inc; Idx; Idx Technologies Inc","","5066248060","","",""
"","Corning Incorporated","United States","http://www.corning.com/","North America","Mature","12","0","2","234","273","375","NYSE:GLW","d2d2d14c-84ed-a85c-3e3a-52eb330083e2","https://www.crunchbase.com/organization/corning?utm_source=crunchbase&utm_medium=export&utm_campaign=odm_csv","Corning; Corning Inc","grid.423732.3, grid.472858.4, grid.472859.5, grid.417796.a","4295903798","","",""
"","National Oilwell Varco Inc.","United States","http://nov.com/","North America","Mature","12","0","2","234","273","375","NYSE:NOV","b0d74f3f-3efb-47c1-01e8-04b86f36d8b1","https://www.crunchbase.com/organization/national-oilwell-varco","National Oilwell Varco; National Oilwell Varco (Nyse: Nov); Nov","grid.480249.3, grid.458176.9, grid.472786.8","4295904589","","",""
